<?xml version="1.0" encoding="UTF-8"?>
<!DOCTYPE panel SYSTEM "panel.dtd">
<panel aeropuerto="JFK" fecha="20/12/2013">
  <vuelo codigo="V22" estado="R" diario="SI">
    <origen>New York</origen>
    <destino>Chicago</destino>
    <hora_salida>9:30</hora_salida>
    <hora_llegada>11:30</hora_llegada>
  </vuelo>

  <vuelo codigo="V23" estado="C" diario="NO">
    <origen>New York</origen>
    <destino>Miami</destino>
    <hora_salida>10:15</hora_salida>
    <hora_llegada>11:15</hora_llegada>
  </vuelo>
</panel>

